{
  "catalogId": "a5f052e5-32d6-4d6c-af16-101879033095",
  "name": "PROSTIN E2 VAGINAL GEL 1 MG",
  "status": "draft",
  "category": "prescription",
  "registrationValidity": "valid",
  "registrationNumber": "056 32 26453 00",
  "treatmentDescriptions": "For labour induction in term and near term pregnant women who have favorable induction features and who have a singleton pregnancy with vertex presentation",
  "termsOfIssue": "Prescription required",
  "form": "gel",
  "route": "vaginal",
  "site": "",
  "method": "",
  "administrationNotes": "",
  "ingredients": "DINOPROSTONE 0.033 %W/W",
  "codes": {
    "atc5": {
      "system": "WHO ATC Classification",
      "code": "G02AD02",
      "name": "DINOPROSTONE"
    }
  },
  "contraindications": "",
  "sideEffect": "",
  "warnings": "תרופה אשפוזית לפי החלטת משרד הבריאות",
  "alternativeMedications": [],
  "packaging": [
    {
      "name": "PROSTIN E2 VAGINAL GEL 2 MG/3GR",
      "manufacturer": {
        "name": "פיזר",
        "countryOfOrigin": "IL"
      },
      "strength": {
        "value": 0,
        "unit": ""
      },
      "quantity": {
        "value": 3.0,
        "unit": "units"
      },
      "packagingDescription": "SYRINGE LDPE",
      "shelfLife": "24",
      "storageConditions": "",
      "codes": {
        "moh": "8928",
        "yarpa": "35605",
        "barcode": "7298074000498"
      },
      "manufacturersAdministrationRecommendation": "",
      "pricing": {
        "currency": "ILS",
        "maxWholesalePrice": 169.4942375,
        "retailMargin": 25.0,
        "maxRetailPrice": 211.8677968,
        "maxPriceWithVAT": 250.0039891
      }
    }
  ],
  "metadata": {
    "version": "1.4",
    "lastUpdated": "2025-08-01T12:18:43.887194"
  }
}